003:003:001:DESCRIPTOR         1593775246.732819
 05 01 09 02 A1 01 85 02 09 01 A1 00 05 09 19 01
 29 10 15 00 25 01 95 10 75 01 81 02 05 01 16 01
 F8 26 FF 07 75 0C 95 02 09 30 09 31 81 06 15 81
 25 7F 75 08 95 01 09 38 81 06 05 0C 0A 38 02 95
 01 81 06 C0 C0 05 0C 09 01 A1 01 85 03 75 10 95
 02 15 01 26 8C 02 19 01 2A 8C 02 81 00 C0 05 01
 09 80 A1 01 85 04 75 02 95 01 15 01 25 03 09 82
 09 81 09 83 81 60 75 06 81 03 C0 06 00 FF 09 01
 A1 01 85 10 75 08 95 06 15 00 26 FF 00 09 01 81
 00 09 01 91 00 C0 06 00 FF 09 02 A1 01 85 11 75
 08 95 13 15 00 26 FF 00 09 02 81 00 09 02 91 00
 C0

003:003:000:DESCRIPTOR         1593775246.736060
 05 01 09 06 A1 01 05 07 19 E0 29 E7 15 00 25 01
 75 01 95 08 81 02 81 03 95 05 05 08 19 01 29 05
 91 02 95 01 75 03 91 01 95 06 75 08 15 00 26 A4
 00 05 07 19 00 2A A4 00 81 00 C0

003:002:002:DESCRIPTOR         1593775246.738826
 06 31 FF 09 76 A1 01 85 5A 19 00 2A FF 00 15 00
 26 FF 00 75 08 95 05 81 00 19 00 2A FF 00 15 00
 26 FF 00 75 08 95 3F B1 00 C0 05 0C 09 01 A1 01
 85 02 19 00 2A 3C 02 15 00 26 3C 02 75 10 95 02
 81 00 C0 06 31 FF 09 79 A1 01 85 5D 19 00 2A FF
 00 15 00 26 FF 00 75 08 95 1F 81 00 19 00 2A FF
 00 15 00 26 FF 00 75 08 95 3F 91 00 19 00 2A FF
 00 15 00 26 FF 00 75 08 95 3F B1 00 C0 06 31 FF
 09 80 A1 01 85 5E 19 00 2A FF 00 15 00 26 FF 00
 75 08 95 05 81 00 19 00 2A FF 00 15 00 26 FF 00
 75 08 95 3F B1 00 C0

003:002:001:DESCRIPTOR         1593775246.741819
 05 01 09 06 A1 01 85 09 75 01 95 08 05 07 19 E0
 29 E7 15 00 25 01 81 02 95 08 75 01 81 03 95 05
 75 01 05 08 19 01 29 05 91 02 95 01 75 03 91 03
 95 F0 75 01 05 07 19 00 29 EF 15 00 25 01 81 02
 C0

003:002:000:DESCRIPTOR         1593775246.744821
 05 01 09 06 A1 01 85 01 75 01 95 08 05 07 19 E0
 29 E7 15 00 25 01 81 02 95 01 75 08 81 03 95 05
 75 01 05 08 19 01 29 05 91 02 95 01 75 03 91 03
 95 1E 75 08 15 00 26 FF 00 05 07 19 00 2A FF 00
 81 00 C0

