001:002:002:DESCRIPTOR         1593321424.949103
 06 31 FF 09 76 A1 01 85 5A 19 00 2A FF 00 15 00
 26 FF 00 75 08 95 05 81 00 19 00 2A FF 00 15 00
 26 FF 00 75 08 95 3F B1 00 C0 05 0C 09 01 A1 01
 85 02 19 00 2A 3C 02 15 00 26 3C 02 75 10 95 02
 81 00 C0 06 31 FF 09 79 A1 01 85 5D 19 00 2A FF
 00 15 00 26 FF 00 75 08 95 1F 81 00 19 00 2A FF
 00 15 00 26 FF 00 75 08 95 3F 91 00 19 00 2A FF
 00 15 00 26 FF 00 75 08 95 3F B1 00 C0 06 31 FF
 09 80 A1 01 85 5E 19 00 2A FF 00 15 00 26 FF 00
 75 08 95 05 81 00 19 00 2A FF 00 15 00 26 FF 00
 75 08 95 3F B1 00 C0

001:002:001:DESCRIPTOR         1593321424.951280
 05 01 09 06 A1 01 85 09 75 01 95 08 05 07 19 E0
 29 E7 15 00 25 01 81 02 95 08 75 01 81 03 95 05
 75 01 05 08 19 01 29 05 91 02 95 01 75 03 91 03
 95 F0 75 01 05 07 19 00 29 EF 15 00 25 01 81 02
 C0

001:002:000:DESCRIPTOR         1593321424.952588
 05 01 09 06 A1 01 85 01 75 01 95 08 05 07 19 E0
 29 E7 15 00 25 01 81 02 95 01 75 08 81 03 95 05
 75 01 05 08 19 01 29 05 91 02 95 01 75 03 91 03
 95 06 75 08 15 00 26 FF 00 05 07 19 00 2A FF 00
 81 00 95 C0 75 01 05 07 19 00 29 EF 15 00 25 01
 81 02 C0

